"No.","Time","Source","Destination","Protocol","Length","Info"
"1","0.000000","192.168.1.6","192.168.1.1","TCP","66","20581  >  53 [SYN] Seq=0 Win=64240 Len=0 MSS=1460 WS=256 SACK_PERM"
"2","0.002209","192.168.1.1","192.168.1.6","TCP","66","53  >  20581 [SYN, ACK] Seq=0 Ack=1 Win=29200 Len=0 MSS=1460 SACK_PERM WS=32"
"3","0.002328","192.168.1.6","192.168.1.1","TCP","54","20581  >  53 [ACK] Seq=1 Ack=1 Win=131328 Len=0"
"4","0.002506","192.168.1.6","192.168.1.1","TCP","56","20581  >  53 [PSH, ACK] Seq=1 Ack=1 Win=131328 Len=2 [TCP PDU reassembled in 5]"
"5","0.002577","192.168.1.6","192.168.1.1","DNS","87","Standard query 0xb7b2 A play.google.com"
"6","0.013197","192.168.1.1","192.168.1.6","TCP","54","53  >  20581 [ACK] Seq=1 Ack=3 Win=29216 Len=0"
"7","0.013197","192.168.1.1","192.168.1.6","TCP","54","53  >  20581 [ACK] Seq=1 Ack=36 Win=29216 Len=0"
"8","1.413107","192.168.1.6","172.64.155.209","TCP","55","19943  >  443 [ACK] Seq=1 Ack=1 Win=514 Len=1"
"9","1.420876","172.64.155.209","192.168.1.6","TCP","66","443  >  19943 [ACK] Seq=1 Ack=2 Win=103 Len=0 SLE=1 SRE=2"
"10","1.585023","192.168.1.6","172.64.155.209","TCP","55","19648  >  443 [ACK] Seq=1 Ack=1 Win=514 Len=1"
"11","1.592489","172.64.155.209","192.168.1.6","TCP","66","443  >  19648 [ACK] Seq=1 Ack=2 Win=23 Len=0 SLE=1 SRE=2"
"12","3.407460","142.251.42.67","192.168.1.6","TLSv1.2","127","Application Data"
"13","3.407872","192.168.1.6","142.251.42.67","TCP","54","20374  >  443 [FIN, ACK] Seq=1 Ack=74 Win=255 Len=0"
"14","3.528026","142.251.42.67","192.168.1.6","TCP","54","443  >  20374 [FIN, ACK] Seq=74 Ack=2 Win=290 Len=0"
"15","3.528205","192.168.1.6","142.251.42.67","TCP","54","20374  >  443 [ACK] Seq=2 Ack=75 Win=255 Len=0"
"16","4.140309","192.168.1.6","192.168.1.1","TCP","54","20581  >  53 [FIN, ACK] Seq=36 Ack=1 Win=131328 Len=0"
"17","4.140719","192.168.1.6","192.168.1.1","TCP","54","20579  >  53 [FIN, ACK] Seq=1 Ack=1 Win=513 Len=0"
"18","4.150537","192.168.1.6","192.168.1.1","DNS","75","Standard query 0xe628 A play.google.com"
"19","4.186565","192.168.1.6","192.168.1.1","DNS","75","Standard query 0xe628 A play.google.com"
"20","4.187455","192.168.1.1","192.168.1.6","DNS","91","Standard query response 0xe628 A play.google.com A 142.250.193.174"
"21","4.187455","192.168.1.1","192.168.1.6","TCP","54","53  >  20581 [ACK] Seq=1 Ack=37 Win=29216 Len=0"
"22","4.187455","192.168.1.1","192.168.1.6","TCP","54","53  >  20579 [ACK] Seq=1 Ack=2 Win=913 Len=0"
"23","4.190523","192.168.1.6","142.250.193.174","QUIC","1292","Initial, DCID=9033300d7f58ed49, PKN: 1, CRYPTO"
"24","4.190694","192.168.1.6","142.250.193.174","QUIC","1292","Initial, DCID=9033300d7f58ed49, PKN: 2, CRYPTO, CRYPTO, PING, PADDING, CRYPTO, PADDING, CRYPTO, PADDING, PING, PADDING"
"25","4.195573","192.168.1.1","192.168.1.6","DNS","91","Standard query response 0xe628 A play.google.com A 142.250.193.174"
"26","4.200783","142.250.193.174","192.168.1.6","QUIC","1292","Initial, SCID=f033300d7f58ed49, PKN: 1, ACK, PADDING"
"27","4.200783","142.250.193.174","192.168.1.6","QUIC","1292","Initial, SCID=f033300d7f58ed49, PKN: 2, CRYPTO, PADDING"
"28","4.200936","142.250.193.174","192.168.1.6","QUIC","1292","Initial, SCID=f033300d7f58ed49, PKN: 3, CRYPTO, PADDING"
"29","4.202700","192.168.1.6","142.250.193.174","QUIC","1292","Initial, DCID=f033300d7f58ed49, PKN: 3, ACK, PADDING"
"30","4.205980","192.168.1.6","142.250.193.174","TCP","66","20582  >  443 [SYN] Seq=0 Win=64240 Len=0 MSS=1460 WS=256 SACK_PERM"
"31","4.214765","142.250.193.174","192.168.1.6","TCP","66","443  >  20582 [SYN, ACK] Seq=0 Ack=1 Win=65535 Len=0 MSS=1412 SACK_PERM WS=256"
"32","4.214960","192.168.1.6","142.250.193.174","TCP","54","20582  >  443 [ACK] Seq=1 Ack=1 Win=131072 Len=0"
"33","4.216910","192.168.1.6","142.250.193.174","TCP","1466","20582  >  443 [ACK] Seq=1 Ack=1 Win=131072 Len=1412 [TCP PDU reassembled in 34]"
"34","4.216910","192.168.1.6","142.250.193.174","TLSv1.3","463","Client Hello (SNI=play.google.com)"
"35","4.221608","192.168.1.6","142.250.193.174","QUIC","79","Handshake, DCID=f033300d7f58ed49"
"36","4.224902","142.250.193.174","192.168.1.6","TCP","54","443  >  20582 [ACK] Seq=1 Ack=1413 Win=68608 Len=0"
"37","4.224902","142.250.193.174","192.168.1.6","TCP","54","443  >  20582 [ACK] Seq=1 Ack=1822 Win=71424 Len=0"
"38","4.232778","142.250.193.174","192.168.1.6","QUIC","1292","Handshake, SCID=f033300d7f58ed49"
"39","4.232778","142.250.193.174","192.168.1.6","QUIC","1292","Handshake, SCID=f033300d7f58ed49"
"40","4.232778","142.250.193.174","192.168.1.6","QUIC","1292","Handshake, SCID=f033300d7f58ed49"
"41","4.233596","192.168.1.6","142.250.193.174","QUIC","81","Handshake, DCID=f033300d7f58ed49"
"42","4.234222","142.250.193.174","192.168.1.6","QUIC","716","Protected Payload (KP0)"
"43","4.234222","142.250.193.174","192.168.1.6","QUIC","83","Handshake, SCID=f033300d7f58ed49"
"44","4.236972","192.168.1.6","142.250.193.174","QUIC","208","Protected Payload (KP0), DCID=f033300d7f58ed49"
"45","4.237698","192.168.1.6","142.250.193.174","QUIC","1288","Protected Payload (KP0), DCID=f033300d7f58ed49"
"46","4.237840","192.168.1.6","142.250.193.174","QUIC","1292","Protected Payload (KP0), DCID=f033300d7f58ed49"
"47","4.237927","192.168.1.6","142.250.193.174","QUIC","340","Protected Payload (KP0), DCID=f033300d7f58ed49"
"48","4.258765","192.168.1.6","142.250.193.174","QUIC","196","Protected Payload (KP0), DCID=f033300d7f58ed49"
"49","4.313277","192.168.1.6","142.250.193.174","QUIC","1292","Protected Payload (KP0), DCID=f033300d7f58ed49"
"50","4.314356","142.250.193.174","192.168.1.6","QUIC","672","Protected Payload (KP0)"
"51","4.314356","142.250.193.174","192.168.1.6","QUIC","179","Protected Payload (KP0)"
"52","4.314574","142.250.193.174","192.168.1.6","QUIC","69","Protected Payload (KP0)"
"53","4.314574","142.250.193.174","192.168.1.6","QUIC","65","Protected Payload (KP0)"
"54","4.314574","142.250.193.174","192.168.1.6","TLSv1.3","1466","Server Hello, Change Cipher Spec"
"55","4.314574","142.250.193.174","192.168.1.6","TCP","1466","443  >  20582 [ACK] Seq=1413 Ack=1822 Win=71424 Len=1412 [TCP PDU reassembled in 59]"
"56","4.314574","142.250.193.174","192.168.1.6","TCP","1466","443  >  20582 [PSH, ACK] Seq=2825 Ack=1822 Win=71424 Len=1412 [TCP PDU reassembled in 59]"
"57","4.314574","142.250.193.174","192.168.1.6","TCP","1466","443  >  20582 [ACK] Seq=4237 Ack=1822 Win=71424 Len=1412 [TCP PDU reassembled in 59]"
"58","4.314574","142.250.193.174","192.168.1.6","TCP","1466","443  >  20582 [ACK] Seq=5649 Ack=1822 Win=71424 Len=1412 [TCP PDU reassembled in 59]"
"59","4.314574","142.250.193.174","192.168.1.6","TLSv1.3","665","Application Data"
"60","4.314574","142.250.193.174","192.168.1.6","QUIC","67","Protected Payload (KP0)"
"61","4.314574","142.250.193.174","192.168.1.6","TCP","665","[TCP Retransmission] 443  >  20582 [PSH, ACK] Seq=7061 Ack=1822 Win=71424 Len=611 [TCP PDU reassembled in 59]"
"62","4.315074","142.250.193.174","192.168.1.6","QUIC","1292","Protected Payload (KP0)"
"63","4.315094","192.168.1.6","142.250.193.174","TCP","54","20582  >  443 [ACK] Seq=1822 Ack=2825 Win=131072 Len=0"
"64","4.315199","192.168.1.6","142.250.193.174","TCP","54","20582  >  443 [ACK] Seq=1822 Ack=5649 Win=131072 Len=0"
"65","4.315346","192.168.1.6","142.250.193.174","TCP","54","20582  >  443 [ACK] Seq=1822 Ack=7672 Win=131072 Len=0"
"66","4.315440","192.168.1.6","142.250.193.174","TCP","66","[TCP Dup ACK 65#1] 20582  >  443 [ACK] Seq=1822 Ack=7672 Win=131072 Len=0 SLE=7061 SRE=7672"
"67","4.318600","192.168.1.6","142.250.193.174","TLSv1.3","118","Change Cipher Spec, Application Data"
"68","4.319006","192.168.1.6","142.250.193.174","QUIC","75","Protected Payload (KP0), DCID=f033300d7f58ed49"
"69","4.319147","192.168.1.6","142.250.193.174","QUIC","75","Protected Payload (KP0), DCID=f033300d7f58ed49"
"70","4.319306","192.168.1.6","142.250.193.174","QUIC","75","Protected Payload (KP0), DCID=f033300d7f58ed49"
"71","4.319473","192.168.1.6","142.250.193.174","QUIC","77","Protected Payload (KP0), DCID=f033300d7f58ed49"
"72","4.322789","142.250.193.174","192.168.1.6","QUIC","69","Protected Payload (KP0)"
"73","4.325642","142.250.193.174","192.168.1.6","TLSv1.3","670","Application Data, Application Data"
"74","4.375217","192.168.1.6","142.250.193.174","TCP","54","20582  >  443 [ACK] Seq=1886 Ack=8288 Win=130560 Len=0"
"75","4.376322","142.250.193.174","192.168.1.6","QUIC","603","Protected Payload (KP0)"
"76","4.376322","142.250.193.174","192.168.1.6","QUIC","139","Protected Payload (KP0)"
"77","4.377230","192.168.1.6","142.250.193.174","QUIC","81","Protected Payload (KP0), DCID=f033300d7f58ed49"
"78","4.377449","192.168.1.6","142.250.193.174","QUIC","77","Protected Payload (KP0), DCID=f033300d7f58ed49"
"79","4.381888","192.168.1.6","192.168.1.1","TCP","66","20583  >  53 [SYN] Seq=0 Win=64240 Len=0 MSS=1460 WS=256 SACK_PERM"
"80","4.382287","192.168.1.6","192.168.1.1","TCP","66","20584  >  53 [SYN] Seq=0 Win=64240 Len=0 MSS=1460 WS=256 SACK_PERM"
"81","4.384533","192.168.1.1","192.168.1.6","TCP","66","53  >  20583 [SYN, ACK] Seq=0 Ack=1 Win=29200 Len=0 MSS=1460 SACK_PERM WS=32"
"82","4.384533","192.168.1.1","192.168.1.6","TCP","66","53  >  20584 [SYN, ACK] Seq=0 Ack=1 Win=29200 Len=0 MSS=1460 SACK_PERM WS=32"
"83","4.384672","192.168.1.6","192.168.1.1","TCP","54","20583  >  53 [ACK] Seq=1 Ack=1 Win=131328 Len=0"
"84","4.384754","192.168.1.6","192.168.1.1","TCP","54","20584  >  53 [ACK] Seq=1 Ack=1 Win=131328 Len=0"
"85","4.384887","192.168.1.6","192.168.1.1","TCP","56","20584  >  53 [PSH, ACK] Seq=1 Ack=1 Win=131328 Len=2 [TCP PDU reassembled in 86]"
"86","4.385006","192.168.1.6","192.168.1.1","DNS","92","Standard query 0x0313 HTTPS beacons.gcp.gvt2.com"
"87","4.385099","192.168.1.6","192.168.1.1","TCP","56","20583  >  53 [PSH, ACK] Seq=1 Ack=1 Win=131328 Len=2 [TCP PDU reassembled in 88]"
"88","4.385175","192.168.1.6","192.168.1.1","DNS","92","Standard query 0x29f8 A beacons.gcp.gvt2.com"
"89","4.389332","192.168.1.1","192.168.1.6","TCP","54","53  >  20584 [ACK] Seq=1 Ack=3 Win=29216 Len=0"
"90","4.389332","192.168.1.1","192.168.1.6","TCP","54","53  >  20584 [ACK] Seq=1 Ack=41 Win=29216 Len=0"
"91","4.389403","192.168.1.1","192.168.1.6","TCP","54","53  >  20583 [ACK] Seq=1 Ack=3 Win=29216 Len=0"
"92","4.389403","192.168.1.1","192.168.1.6","TCP","54","53  >  20583 [ACK] Seq=1 Ack=41 Win=29216 Len=0"
"93","4.498975","192.168.1.6","142.250.193.174","QUIC","72","Protected Payload (KP0), DCID=f033300d7f58ed49"
"94","4.500104","192.168.1.1","192.168.1.6","TCP","55","53  >  20584 [PSH, ACK] Seq=1 Ack=41 Win=29216 Len=1 [TCP PDU reassembled in 101]"
"95","4.500104","142.250.193.174","192.168.1.6","QUIC","66","Protected Payload (KP0)"
"96","4.500256","192.168.1.1","192.168.1.6","TCP","55","53  >  20583 [PSH, ACK] Seq=1 Ack=41 Win=29216 Len=1 [TCP PDU reassembled in 102]"
"97","4.545723","192.168.1.6","192.168.1.1","TCP","54","20584  >  53 [ACK] Seq=41 Ack=2 Win=131328 Len=0"
"98","4.545803","192.168.1.6","192.168.1.1","TCP","54","20583  >  53 [ACK] Seq=41 Ack=2 Win=131328 Len=0"
"99","4.647465","192.168.1.6","142.250.193.174","QUIC","71","Protected Payload (KP0), DCID=f033300d7f58ed49"
"100","4.648586","142.250.193.174","192.168.1.6","QUIC","67","Protected Payload (KP0)"
"101","4.648586","192.168.1.1","192.168.1.6","DNS","206","Standard query response 0x0313 HTTPS beacons.gcp.gvt2.com CNAME beacons-handoff.gcp.gvt2.com CNAME gce-beacons.gcp.gvt2.com SOA ns1.google.com"
"102","4.648855","192.168.1.1","192.168.1.6","DNS","139","Standard query response 0x29f8 A beacons.gcp.gvt2.com CNAME beacons-handoff.gcp.gvt2.com A 172.217.163.163"
"103","4.649025","192.168.1.6","192.168.1.1","TCP","54","20583  >  53 [FIN, ACK] Seq=41 Ack=87 Win=131072 Len=0"
"104","4.649459","192.168.1.6","192.168.1.1","TCP","54","20584  >  53 [FIN, ACK] Seq=41 Ack=154 Win=131072 Len=0"
"105","4.650773","192.168.1.6","172.217.163.163","QUIC","1292","Initial, DCID=4cd2446e7d1443fd, PKN: 1, CRYPTO"
"106","4.650786","192.168.1.1","192.168.1.6","TCP","54","53  >  20583 [FIN, ACK] Seq=87 Ack=42 Win=29216 Len=0"
"107","4.650825","192.168.1.6","192.168.1.1","TCP","54","20583  >  53 [ACK] Seq=42 Ack=88 Win=131072 Len=0"
"108","4.650841","192.168.1.6","172.217.163.163","QUIC","1292","Initial, DCID=4cd2446e7d1443fd, PKN: 2, CRYPTO"
"109","4.650872","192.168.1.6","172.217.163.163","QUIC","1292","Initial, DCID=4cd2446e7d1443fd, PKN: 3, PADDING, PING, CRYPTO, CRYPTO, PING, CRYPTO, PING, PING, PADDING, CRYPTO, PING, CRYPTO, PING, PADDING, CRYPTO, PADDING, PING, PADDING, PING, PADDING"
"110","4.651270","192.168.1.6","172.217.163.163","QUIC","122","0-RTT, DCID=4cd2446e7d1443fd"
"111","4.652442","192.168.1.1","192.168.1.6","TCP","54","53  >  20584 [FIN, ACK] Seq=154 Ack=42 Win=29216 Len=0"
"112","4.652486","192.168.1.6","192.168.1.1","TCP","54","20584  >  53 [ACK] Seq=42 Ack=155 Win=131072 Len=0"
"113","4.667949","142.250.193.174","192.168.1.6","QUIC","69","Protected Payload (KP0)"
"114","4.667949","172.217.163.163","192.168.1.6","QUIC","1292","Initial, SCID=ecd2446e7d1443fd, PKN: 1, ACK, PADDING"
"115","4.668199","172.217.163.163","192.168.1.6","QUIC","1292","Initial, SCID=ecd2446e7d1443fd, PKN: 2, ACK, PADDING"
"116","4.674798","192.168.1.6","172.217.163.163","QUIC","1292","Initial, DCID=ecd2446e7d1443fd, PKN: 6, PADDING, PING, PADDING"
"117","4.682543","172.217.163.163","192.168.1.6","QUIC","1292","Initial, SCID=ecd2446e7d1443fd, PKN: 3, ACK, PADDING"
"118","4.732794","192.168.1.6","172.217.163.163","QUIC","1292","Initial, DCID=ecd2446e7d1443fd, PKN: 8, PADDING, PING, PADDING"
"119","4.734602","172.217.163.163","192.168.1.6","QUIC","1292","Initial, SCID=ecd2446e7d1443fd, PKN: 4, CRYPTO, PADDING"
"120","4.734602","172.217.163.163","192.168.1.6","QUIC","339","Protected Payload (KP0)"
"121","4.734602","172.217.163.163","192.168.1.6","QUIC","995","Protected Payload (KP0)"
"122","4.734602","172.217.163.163","192.168.1.6","QUIC","66","Protected Payload (KP0)"
"123","4.734602","172.217.163.163","192.168.1.6","QUIC","66","Protected Payload (KP0)"
"124","4.736621","192.168.1.6","172.217.163.163","QUIC","1292","Handshake, DCID=ecd2446e7d1443fd"
"125","4.737034","192.168.1.6","172.217.163.163","QUIC","73","Protected Payload (KP0), DCID=ecd2446e7d1443fd"
"126","4.737916","192.168.1.6","172.217.163.163","QUIC","968","Protected Payload (KP0), DCID=ecd2446e7d1443fd"
"127","4.794304","192.168.1.6","172.217.163.163","QUIC","1036","Protected Payload (KP0), DCID=ecd2446e7d1443fd"
"128","4.798424","172.217.163.163","192.168.1.6","QUIC","1292","Initial, SCID=ecd2446e7d1443fd, PKN: 10, ACK, CRYPTO, PADDING"
"129","4.798424","172.217.163.163","192.168.1.6","QUIC","162","Protected Payload (KP0)"
"130","4.798780","172.217.163.163","192.168.1.6","QUIC","71","Protected Payload (KP0)"
"131","4.799031","192.168.1.6","172.217.163.163","QUIC","76","Protected Payload (KP0), DCID=ecd2446e7d1443fd"
"132","4.799198","192.168.1.6","172.217.163.163","QUIC","75","Protected Payload (KP0), DCID=ecd2446e7d1443fd"
"133","4.801571","172.217.163.163","192.168.1.6","QUIC","69","Protected Payload (KP0)"
"134","4.997931","192.168.1.6","20.212.88.117","TCP","55","19633  >  443 [ACK] Seq=1 Ack=1 Win=515 Len=1 [TCP PDU reassembled in 1184]"
"135","5.000217","172.217.163.163","192.168.1.6","QUIC","918","Protected Payload (KP0)"
"136","5.000217","172.217.163.163","192.168.1.6","QUIC","63","Protected Payload (KP0)"
"137","5.001619","192.168.1.6","172.217.163.163","QUIC","79","Protected Payload (KP0), DCID=ecd2446e7d1443fd"
"138","5.028314","192.168.1.6","172.217.163.163","QUIC","76","Protected Payload (KP0), DCID=ecd2446e7d1443fd"
"139","5.041470","172.217.163.163","192.168.1.6","QUIC","66","Protected Payload (KP0)"
"140","5.041470","20.212.88.117","192.168.1.6","TCP","66","443  >  19633 [ACK] Seq=1 Ack=2 Win=251 Len=0 SLE=1 SRE=2"
"141","5.294355","192.168.1.6","142.250.193.174","QUIC","1288","Protected Payload (KP0), DCID=f033300d7f58ed49"
"142","5.294449","192.168.1.6","142.250.193.174","QUIC","1292","Protected Payload (KP0), DCID=f033300d7f58ed49"
"143","5.294481","192.168.1.6","142.250.193.174","QUIC","1292","Protected Payload (KP0), DCID=f033300d7f58ed49"
"144","5.294510","192.168.1.6","142.250.193.174","QUIC","541","Protected Payload (KP0), DCID=f033300d7f58ed49"
"145","5.302824","142.250.193.174","192.168.1.6","QUIC","73","Protected Payload (KP0)"
"146","5.302824","142.250.193.174","192.168.1.6","QUIC","69","Protected Payload (KP0)"
"147","5.302824","142.250.193.174","192.168.1.6","QUIC","71","Protected Payload (KP0)"
"148","5.302824","142.250.193.174","192.168.1.6","QUIC","69","Protected Payload (KP0)"
"149","5.328928","192.168.1.6","142.250.193.174","QUIC","74","Protected Payload (KP0), DCID=f033300d7f58ed49"
"150","5.507066","192.168.1.6","142.250.193.174","QUIC","71","Protected Payload (KP0), DCID=f033300d7f58ed49"
"151","5.508787","142.250.193.174","192.168.1.6","QUIC","433","Protected Payload (KP0)"
"152","5.508787","142.250.193.174","192.168.1.6","QUIC","285","Protected Payload (KP0)"
"153","5.510206","192.168.1.6","142.250.193.174","QUIC","77","Protected Payload (KP0), DCID=f033300d7f58ed49"
"154","5.535843","142.250.193.174","192.168.1.6","QUIC","433","Protected Payload (KP0)"
"155","5.535843","142.250.193.174","192.168.1.6","QUIC","65","Protected Payload (KP0)"
"156","5.536239","192.168.1.6","142.250.193.174","QUIC","75","Protected Payload (KP0), DCID=f033300d7f58ed49"
"157","6.234621","192.168.1.6","192.168.1.1","TCP","66","20585  >  53 [SYN] Seq=0 Win=64240 Len=0 MSS=1460 WS=256 SACK_PERM"
"158","6.234962","192.168.1.6","192.168.1.1","TCP","66","20586  >  53 [SYN] Seq=0 Win=64240 Len=0 MSS=1460 WS=256 SACK_PERM"
"159","6.237090","192.168.1.1","192.168.1.6","TCP","66","53  >  20585 [SYN, ACK] Seq=0 Ack=1 Win=29200 Len=0 MSS=1460 SACK_PERM WS=32"
"160","6.237090","192.168.1.1","192.168.1.6","TCP","66","53  >  20586 [SYN, ACK] Seq=0 Ack=1 Win=29200 Len=0 MSS=1460 SACK_PERM WS=32"
"161","6.237193","192.168.1.6","192.168.1.1","TCP","54","20585  >  53 [ACK] Seq=1 Ack=1 Win=131328 Len=0"
"162","6.237242","192.168.1.6","192.168.1.1","TCP","54","20586  >  53 [ACK] Seq=1 Ack=1 Win=131328 Len=0"
"163","6.237392","192.168.1.6","192.168.1.1","TCP","56","20586  >  53 [PSH, ACK] Seq=1 Ack=1 Win=131328 Len=2 [TCP PDU reassembled in 164]"
"164","6.237448","192.168.1.6","192.168.1.1","DNS","89","Standard query 0xf78a HTTPS fonts.gstatic.com"
"165","6.237524","192.168.1.6","192.168.1.1","TCP","56","20585  >  53 [PSH, ACK] Seq=1 Ack=1 Win=131328 Len=2 [TCP PDU reassembled in 166]"
"166","6.237571","192.168.1.6","192.168.1.1","DNS","89","Standard query 0x8e85 A fonts.gstatic.com"
"167","6.240267","192.168.1.1","192.168.1.6","TCP","54","53  >  20586 [ACK] Seq=1 Ack=3 Win=29216 Len=0"
"168","6.240267","192.168.1.1","192.168.1.6","TCP","54","53  >  20586 [ACK] Seq=1 Ack=38 Win=29216 Len=0"
"169","6.240267","192.168.1.1","192.168.1.6","TCP","54","53  >  20585 [ACK] Seq=1 Ack=3 Win=29216 Len=0"
"170","6.240267","192.168.1.1","192.168.1.6","TCP","54","53  >  20585 [ACK] Seq=1 Ack=38 Win=29216 Len=0"
"171","6.256801","192.168.1.6","142.250.192.4","UDP","1288","57976  >  443 Len=1246"
"172","6.257024","192.168.1.6","142.250.192.4","UDP","1056","57976  >  443 Len=1014"
"173","6.257200","192.168.1.1","192.168.1.6","TCP","55","53  >  20586 [PSH, ACK] Seq=1 Ack=38 Win=29216 Len=1 [TCP PDU reassembled in 204]"
"174","6.258285","192.168.1.1","192.168.1.6","TCP","55","53  >  20585 [PSH, ACK] Seq=1 Ack=38 Win=29216 Len=1 [TCP PDU reassembled in 205]"
"175","6.263896","192.168.1.6","140.82.112.25","TLSv1.2","242","Application Data"
"176","6.282325","142.250.192.4","192.168.1.6","UDP","67","443  >  57976 Len=25"
"177","6.283648","142.250.192.4","192.168.1.6","UDP","71","443  >  57976 Len=29"
"178","6.294565","192.168.1.6","20.207.73.85","TCP","66","20587  >  443 [SYN] Seq=0 Win=64240 Len=0 MSS=1460 WS=256 SACK_PERM"
"179","6.298270","192.168.1.6","192.168.1.1","TCP","66","20588  >  53 [SYN] Seq=0 Win=64240 Len=0 MSS=1460 WS=256 SACK_PERM"
"180","6.298517","192.168.1.6","192.168.1.1","TCP","66","20589  >  53 [SYN] Seq=0 Win=64240 Len=0 MSS=1460 WS=256 SACK_PERM"
"181","6.300945","192.168.1.6","142.250.192.4","UDP","794","57976  >  443 Len=752"
"182","6.301961","192.168.1.1","192.168.1.6","TCP","66","53  >  20588 [SYN, ACK] Seq=0 Ack=1 Win=29200 Len=0 MSS=1460 SACK_PERM WS=32"
"183","6.301961","192.168.1.1","192.168.1.6","TCP","66","53  >  20589 [SYN, ACK] Seq=0 Ack=1 Win=29200 Len=0 MSS=1460 SACK_PERM WS=32"
"184","6.302069","192.168.1.6","192.168.1.1","TCP","54","20588  >  53 [ACK] Seq=1 Ack=1 Win=131328 Len=0"
"185","6.302116","192.168.1.6","192.168.1.1","TCP","54","20589  >  53 [ACK] Seq=1 Ack=1 Win=131328 Len=0"
"186","6.302224","192.168.1.6","192.168.1.1","TCP","56","20589  >  53 [PSH, ACK] Seq=1 Ack=1 Win=131328 Len=2 [TCP PDU reassembled in 187]"
"187","6.302286","192.168.1.6","192.168.1.1","DNS","96","Standard query 0x2857 HTTPS www.googleadservices.com"
"188","6.302592","192.168.1.6","192.168.1.1","TCP","56","20588  >  53 [PSH, ACK] Seq=1 Ack=1 Win=131328 Len=2 [TCP PDU reassembled in 189]"
"189","6.302634","192.168.1.6","192.168.1.1","DNS","96","Standard query 0x6c98 A www.googleadservices.com"
"190","6.304885","192.168.1.6","192.168.1.1","TCP","54","20586  >  53 [ACK] Seq=38 Ack=2 Win=131328 Len=0"
"191","6.304972","192.168.1.6","192.168.1.1","TCP","54","20585  >  53 [ACK] Seq=38 Ack=2 Win=131328 Len=0"
"192","6.305150","192.168.1.1","192.168.1.6","TCP","54","53  >  20589 [ACK] Seq=1 Ack=3 Win=29216 Len=0"
"193","6.305150","192.168.1.1","192.168.1.6","TCP","54","53  >  20589 [ACK] Seq=1 Ack=45 Win=29216 Len=0"
"194","6.305208","192.168.1.1","192.168.1.6","TCP","54","53  >  20588 [ACK] Seq=1 Ack=3 Win=29216 Len=0"
"195","6.305208","192.168.1.1","192.168.1.6","TCP","54","53  >  20588 [ACK] Seq=1 Ack=45 Win=29216 Len=0"
"196","6.321356","192.168.1.6","140.82.112.25","TLSv1.2","84","Application Data"
"197","6.321548","192.168.1.6","140.82.112.25","TCP","54","20557  >  443 [FIN, ACK] Seq=219 Ack=1 Win=510 Len=0"
"198","6.325030","192.168.1.1","192.168.1.6","TCP","55","53  >  20589 [PSH, ACK] Seq=1 Ack=45 Win=29216 Len=1 [TCP PDU reassembled in 233]"
"199","6.325030","192.168.1.1","192.168.1.6","TCP","55","53  >  20588 [PSH, ACK] Seq=1 Ack=45 Win=29216 Len=1 [TCP PDU reassembled in 234]"
"200","6.326766","20.207.73.85","192.168.1.6","TCP","66","443  >  20587 [SYN, ACK] Seq=0 Ack=1 Win=65535 Len=0 MSS=1436 SACK_PERM WS=1024"
"201","6.326965","192.168.1.6","20.207.73.85","TCP","54","20587  >  443 [ACK] Seq=1 Ack=1 Win=132096 Len=0"
"202","6.328104","192.168.1.6","20.207.73.85","TCP","1490","20587  >  443 [ACK] Seq=1 Ack=1 Win=132096 Len=1436 [TCP PDU reassembled in 203]"
"203","6.328104","192.168.1.6","20.207.73.85","TLSv1.3","485","Client Hello (SNI=api.github.com)"
"204","6.329700","192.168.1.1","192.168.1.6","DNS","147","Standard query response 0xf78a HTTPS fonts.gstatic.com SOA ns1.google.com"
"205","6.329879","192.168.1.1","192.168.1.6","DNS","106","Standard query response 0x8e85 A fonts.gstatic.com A 142.250.195.131"
"206","6.330108","192.168.1.6","192.168.1.1","TCP","54","20586  >  53 [FIN, ACK] Seq=38 Ack=95 Win=131072 Len=0"
"207","6.330262","192.168.1.6","192.168.1.1","TCP","54","20585  >  53 [FIN, ACK] Seq=38 Ack=54 Win=131328 Len=0"
"208","6.331978","192.168.1.1","192.168.1.6","TCP","54","53  >  20586 [FIN, ACK] Seq=95 Ack=39 Win=29216 Len=0"
"209","6.332035","192.168.1.6","192.168.1.1","TCP","54","20586  >  53 [ACK] Seq=39 Ack=96 Win=131072 Len=0"
"210","6.332649","192.168.1.6","142.250.182.67","QUIC","1292","Initial, DCID=22beabb701c22c7b, PKN: 1, CRYPTO"
"211","6.332733","192.168.1.6","142.250.182.67","QUIC","1292","Initial, DCID=22beabb701c22c7b, PKN: 2, PADDING, PING, CRYPTO, PING"
"212","6.332967","192.168.1.6","142.250.182.67","QUIC","118","0-RTT, DCID=22beabb701c22c7b"
"213","6.333968","192.168.1.6","142.250.182.67","QUIC","1288","0-RTT, DCID=22beabb701c22c7b"
"214","6.334051","192.168.1.6","142.250.182.67","QUIC","940","0-RTT, DCID=22beabb701c22c7b"
"215","6.335279","192.168.1.1","192.168.1.6","TCP","54","53  >  20585 [FIN, ACK] Seq=54 Ack=39 Win=29216 Len=0"
"216","6.335329","192.168.1.6","192.168.1.1","TCP","54","20585  >  53 [ACK] Seq=39 Ack=55 Win=131328 Len=0"
"217","6.340314","142.250.182.67","192.168.1.6","QUIC","1292","Initial, SCID=e2beabb701c22c7b, PKN: 1, ACK, PADDING"
"218","6.343285","192.168.1.6","142.250.192.4","UDP","332","57976  >  443 Len=290"
"219","6.349358","142.250.192.4","192.168.1.6","UDP","70","443  >  57976 Len=28"
"220","6.357142","192.168.1.6","142.250.182.67","QUIC","1292","Initial, DCID=e2beabb701c22c7b, PKN: 7, PADDING, PING, PADDING"
"221","6.357961","20.207.73.85","192.168.1.6","TCP","54","443  >  20587 [ACK] Seq=1 Ack=1868 Win=71680 Len=0"
"222","6.358160","20.207.73.85","192.168.1.6","TLSv1.3","1490","Server Hello, Change Cipher Spec, Application Data"
"223","6.358368","20.207.73.85","192.168.1.6","TCP","1490","443  >  20587 [PSH, ACK] Seq=1437 Ack=1868 Win=71680 Len=1436 [TCP PDU reassembled in 224]"
"224","6.358368","20.207.73.85","192.168.1.6","TLSv1.3","673","Application Data, Application Data, Application Data"
"225","6.358436","192.168.1.6","20.207.73.85","TCP","54","20587  >  443 [ACK] Seq=1868 Ack=2873 Win=132096 Len=0"
"226","6.359939","192.168.1.6","20.207.73.85","TLSv1.3","118","Change Cipher Spec, Application Data"
"227","6.360199","192.168.1.6","20.207.73.85","TLSv1.3","146","Application Data"
"228","6.360411","192.168.1.6","20.207.73.85","TLSv1.3","808","Application Data"
"229","6.360488","192.168.1.6","20.207.73.85","TLSv1.3","1304","Application Data"
"230","6.365711","192.168.1.6","192.168.1.1","TCP","54","20589  >  53 [ACK] Seq=45 Ack=2 Win=131328 Len=0"
"231","6.365835","192.168.1.6","192.168.1.1","TCP","54","20588  >  53 [ACK] Seq=45 Ack=2 Win=131328 Len=0"
"232","6.370704","142.250.182.67","192.168.1.6","QUIC","1292","Initial, SCID=e2beabb701c22c7b, PKN: 2, ACK, PADDING"
"233","6.370704","192.168.1.1","192.168.1.6","DNS","122","Standard query response 0x2857 HTTPS www.googleadservices.com HTTPS"
"234","6.370704","192.168.1.1","192.168.1.6","DNS","113","Standard query response 0x6c98 A www.googleadservices.com A 142.250.192.34"
"235","6.371186","192.168.1.6","192.168.1.1","TCP","54","20588  >  53 [FIN, ACK] Seq=45 Ack=61 Win=131328 Len=0"
"236","6.371741","192.168.1.6","192.168.1.1","TCP","54","20589  >  53 [FIN, ACK] Seq=45 Ack=70 Win=131328 Len=0"
"237","6.372982","142.250.182.67","192.168.1.6","QUIC","1292","Initial, SCID=e2beabb701c22c7b, PKN: 3, CRYPTO, PADDING"
"238","6.372982","142.250.182.67","192.168.1.6","QUIC","342","Protected Payload (KP0)"
"239","6.373027","192.168.1.6","142.250.192.34","QUIC","1292","Initial, DCID=6e640d544b265d20, PKN: 1, CRYPTO"
"240","6.373107","192.168.1.6","142.250.192.34","QUIC","1292","Initial, DCID=6e640d544b265d20, PKN: 2, CRYPTO, CRYPTO, PADDING, CRYPTO, CRYPTO, CRYPTO, PADDING, PING, CRYPTO, PADDING"
"241","6.373319","192.168.1.6","142.250.192.34","QUIC","120","0-RTT, DCID=6e640d544b265d20"
"242","6.373833","142.250.182.67","192.168.1.6","QUIC","982","Protected Payload (KP0)"
"243","6.373833","142.250.182.67","192.168.1.6","QUIC","67","Protected Payload (KP0)"
"244","6.374301","192.168.1.6","142.250.182.67","QUIC","120","Handshake, DCID=e2beabb701c22c7b"
"245","6.374404","192.168.1.6","142.250.182.67","QUIC","73","Protected Payload (KP0), DCID=e2beabb701c22c7b"
"246","6.374695","192.168.1.6","142.250.192.34","QUIC","764","0-RTT, DCID=6e640d544b265d20"
"247","6.374806","192.168.1.6","142.250.192.4","UDP","74","57976  >  443 Len=32"
"248","6.375433","192.168.1.1","192.168.1.6","TCP","54","53  >  20588 [FIN, ACK] Seq=61 Ack=46 Win=29216 Len=0"
"249","6.375433","192.168.1.1","192.168.1.6","TCP","54","53  >  20589 [FIN, ACK] Seq=70 Ack=46 Win=29216 Len=0"
"250","6.375501","192.168.1.6","192.168.1.1","TCP","54","20588  >  53 [ACK] Seq=46 Ack=62 Win=131328 Len=0"
"251","6.375606","192.168.1.6","192.168.1.1","TCP","54","20589  >  53 [ACK] Seq=46 Ack=71 Win=131328 Len=0"
"252","6.382076","142.250.182.67","192.168.1.6","QUIC","162","Protected Payload (KP0)"
"253","6.382076","142.250.182.67","192.168.1.6","QUIC","64","Protected Payload (KP0)"
"254","6.382670","192.168.1.6","142.250.182.67","QUIC","73","Protected Payload (KP0), DCID=e2beabb701c22c7b"
"255","6.386355","192.168.1.6","192.168.1.1","TCP","66","20590  >  53 [SYN] Seq=0 Win=64240 Len=0 MSS=1460 WS=256 SACK_PERM"
"256","6.386983","192.168.1.6","192.168.1.1","TCP","66","20591  >  53 [SYN] Seq=0 Win=64240 Len=0 MSS=1460 WS=256 SACK_PERM"
"257","6.396393","142.250.192.4","192.168.1.6","UDP","1288","443  >  57976 Len=1246"
"258","6.396393","142.250.192.4","192.168.1.6","UDP","703","443  >  57976 Len=661"
"259","6.396393","142.250.192.4","192.168.1.6","UDP","67","443  >  57976 Len=25"
"260","6.396507","142.250.192.4","192.168.1.6","UDP","230","443  >  57976 Len=188"
"261","6.396507","20.207.73.85","192.168.1.6","TLSv1.3","133","Application Data"
"262","6.396507","20.207.73.85","192.168.1.6","TLSv1.3","133","Application Data"
"263","6.396507","20.207.73.85","192.168.1.6","TLSv1.3","118","Application Data"
"264","6.396507","20.207.73.85","192.168.1.6","TCP","54","443  >  20587 [ACK] Seq=3714 Ack=4028 Win=77824 Len=0"
"265","6.396507","20.207.73.85","192.168.1.6","TLSv1.3","102","Application Data"
"266","6.396507","192.168.1.1","192.168.1.6","TCP","66","53  >  20590 [SYN, ACK] Seq=0 Ack=1 Win=29200 Len=0 MSS=1460 SACK_PERM WS=32"
"267","6.396507","192.168.1.1","192.168.1.6","TCP","66","53  >  20591 [SYN, ACK] Seq=0 Ack=1 Win=29200 Len=0 MSS=1460 SACK_PERM WS=32"
"268","6.396635","192.168.1.6","192.168.1.1","TCP","54","20590  >  53 [ACK] Seq=1 Ack=1 Win=131328 Len=0"
"269","6.396689","192.168.1.6","192.168.1.1","TCP","54","20591  >  53 [ACK] Seq=1 Ack=1 Win=131328 Len=0"
"270","6.396807","192.168.1.6","20.207.73.85","TCP","54","20587  >  443 [ACK] Seq=4028 Ack=3650 Win=131328 Len=0"
"271","6.396862","192.168.1.6","20.207.73.85","TCP","54","20587  >  443 [ACK] Seq=4028 Ack=3762 Win=131072 Len=0"
"272","6.396929","192.168.1.6","142.250.192.4","UDP","77","57976  >  443 Len=35"
"273","6.397022","192.168.1.6","142.250.192.4","UDP","73","57976  >  443 Len=31"
"274","6.397111","192.168.1.6","192.168.1.1","TCP","56","20591  >  53 [PSH, ACK] Seq=1 Ack=1 Win=131328 Len=2 [TCP PDU reassembled in 275]"
"275","6.397144","192.168.1.6","192.168.1.1","DNS","100","Standard query 0x6292 HTTPS ogads-pa.clients6.google.com"
"276","6.397188","192.168.1.6","192.168.1.1","TCP","56","20590  >  53 [PSH, ACK] Seq=1 Ack=1 Win=131328 Len=2 [TCP PDU reassembled in 277]"
"277","6.397215","192.168.1.6","192.168.1.1","DNS","100","Standard query 0x16cc A ogads-pa.clients6.google.com"
"278","6.397839","192.168.1.6","20.207.73.85","TLSv1.3","85","Application Data"
"279","6.400719","192.168.1.1","192.168.1.6","TCP","54","53  >  20591 [ACK] Seq=1 Ack=3 Win=29216 Len=0"
"280","6.400719","192.168.1.1","192.168.1.6","TCP","54","53  >  20591 [ACK] Seq=1 Ack=49 Win=29216 Len=0"
"281","6.401539","192.168.1.1","192.168.1.6","TCP","54","53  >  20590 [ACK] Seq=1 Ack=3 Win=29216 Len=0"
"282","6.401539","192.168.1.1","192.168.1.6","TCP","54","53  >  20590 [ACK] Seq=1 Ack=49 Win=29216 Len=0"
"283","6.412878","142.250.192.34","192.168.1.6","QUIC","1292","Initial, SCID=ee640d544b265d20, PKN: 1, ACK, PADDING"
"284","6.412878","142.250.192.34","192.168.1.6","QUIC","1292","Initial, SCID=ee640d544b265d20, PKN: 2, CRYPTO, PADDING"
"285","6.412961","142.250.182.67","192.168.1.6","QUIC","310","Protected Payload (KP0)"
"286","6.412961","142.250.182.67","192.168.1.6","QUIC","63","Protected Payload (KP0)"
"287","6.413612","192.168.1.6","142.250.182.67","QUIC","77","Protected Payload (KP0), DCID=e2beabb701c22c7b"
"288","6.414767","192.168.1.6","142.250.192.34","QUIC","1292","Initial, DCID=ee640d544b265d20, PKN: 5, ACK, PADDING"
"289","6.418051","192.168.1.1","192.168.1.6","TCP","55","53  >  20591 [PSH, ACK] Seq=1 Ack=49 Win=29216 Len=1 [TCP PDU reassembled in 301]"
"290","6.418197","192.168.1.1","192.168.1.6","TCP","55","53  >  20590 [PSH, ACK] Seq=1 Ack=49 Win=29216 Len=1 [TCP PDU reassembled in 302]"
"291","6.421072","142.250.182.67","192.168.1.6","QUIC","67","Protected Payload (KP0)"
"292","6.421430","142.250.192.4","192.168.1.6","UDP","741","443  >  57976 Len=699"
"293","6.421854","192.168.1.6","142.250.192.34","QUIC","79","Handshake, DCID=ee640d544b265d20"
"294","6.423092","142.250.192.4","192.168.1.6","UDP","63","443  >  57976 Len=21"
"295","6.423371","192.168.1.6","142.250.192.4","UDP","77","57976  >  443 Len=35"
"296","6.442537","142.250.192.4","192.168.1.6","UDP","356","443  >  57976 Len=314"
"297","6.442537","142.250.192.4","192.168.1.6","UDP","63","443  >  57976 Len=21"
"298","6.442900","192.168.1.6","142.250.192.4","UDP","77","57976  >  443 Len=35"
"299","6.457998","192.168.1.6","192.168.1.1","TCP","54","20591  >  53 [ACK] Seq=49 Ack=2 Win=131328 Len=0"
"300","6.458082","192.168.1.6","192.168.1.1","TCP","54","20590  >  53 [ACK] Seq=49 Ack=2 Win=131328 Len=0"
"301","6.459652","192.168.1.1","192.168.1.6","DNS","151","Standard query response 0x6292 HTTPS ogads-pa.clients6.google.com SOA ns1.google.com"
"302","6.459652","192.168.1.1","192.168.1.6","DNS","117","Standard query response 0x16cc A ogads-pa.clients6.google.com A 142.250.195.170"
"303","6.459796","192.168.1.6","192.168.1.1","TCP","54","20591  >  53 [FIN, ACK] Seq=49 Ack=99 Win=131072 Len=0"
"304","6.460246","192.168.1.6","192.168.1.1","TCP","54","20590  >  53 [FIN, ACK] Seq=49 Ack=65 Win=131328 Len=0"
"305","6.461326","192.168.1.6","142.250.195.170","QUIC","1292","Initial, DCID=9815d463ba19ee7e, PKN: 1, CRYPTO"
"306","6.461407","192.168.1.6","142.250.195.170","QUIC","1292","Initial, DCID=9815d463ba19ee7e, PKN: 2, CRYPTO"
"307","6.461449","192.168.1.6","142.250.195.170","QUIC","1292","Initial, DCID=9815d463ba19ee7e, PKN: 3, CRYPTO, PADDING, CRYPTO, PADDING, CRYPTO, PADDING, PING"
"308","6.461670","192.168.1.6","142.250.195.170","QUIC","123","0-RTT, DCID=9815d463ba19ee7e"
"309","6.462735","192.168.1.6","142.250.192.4","UDP","456","57976  >  443 Len=414"
"310","6.463142","192.168.1.6","142.250.192.4","UDP","633","57976  >  443 Len=591"
"311","6.463808","192.168.1.1","192.168.1.6","TCP","54","53  >  20591 [FIN, ACK] Seq=99 Ack=50 Win=29216 Len=0"
"312","6.463854","192.168.1.6","192.168.1.1","TCP","54","20591  >  53 [ACK] Seq=50 Ack=100 Win=131072 Len=0"
"313","6.466165","192.168.1.1","192.168.1.6","TCP","54","53  >  20590 [FIN, ACK] Seq=65 Ack=50 Win=29216 Len=0"
"314","6.466165","142.250.192.4","192.168.1.6","UDP","65","443  >  57976 Len=23"
"315","6.466314","192.168.1.6","192.168.1.1","TCP","54","20590  >  53 [ACK] Seq=50 Ack=66 Win=131328 Len=0"
"316","6.466635","20.207.73.85","192.168.1.6","TCP","54","443  >  20587 [ACK] Seq=3762 Ack=4059 Win=77824 Len=0"
"317","6.469689","142.250.195.170","192.168.1.6","QUIC","1292","Initial, SCID=f815d463ba19ee7e, PKN: 1, ACK, PADDING"
"318","6.469689","142.250.195.170","192.168.1.6","QUIC","1292","Initial, SCID=f815d463ba19ee7e, PKN: 2, ACK, PADDING"
"319","6.470257","142.250.195.170","192.168.1.6","QUIC","1292","Initial, SCID=f815d463ba19ee7e, PKN: 3, CRYPTO, PADDING"
"320","6.471595","192.168.1.6","142.250.195.170","QUIC","1292","Initial, DCID=f815d463ba19ee7e, PKN: 5, ACK, PADDING"
"321","6.471767","142.250.192.34","192.168.1.6","QUIC","1292","Handshake, SCID=ee640d544b265d20"
"322","6.471767","142.250.192.34","192.168.1.6","QUIC","1292","Handshake, SCID=ee640d544b265d20"
"323","6.471990","142.250.192.34","192.168.1.6","QUIC","1275","Protected Payload (KP0)"
"324","6.471990","142.250.192.34","192.168.1.6","QUIC","82","Handshake, SCID=ee640d544b265d20"
"325","6.472024","192.168.1.6","142.250.192.34","QUIC","81","Handshake, DCID=ee640d544b265d20"
"326","6.473001","192.168.1.6","142.250.192.34","QUIC","892","Protected Payload (KP0), DCID=ee640d544b265d20"
"327","6.473120","192.168.1.6","142.250.195.170","QUIC","79","Handshake, DCID=f815d463ba19ee7e"
"328","6.473969","192.168.1.6","104.26.10.240","TCP","54","20461  >  443 [FIN, ACK] Seq=1 Ack=1 Win=1023 Len=0"
"329","6.486566","104.26.10.240","192.168.1.6","TCP","54","443  >  20461 [FIN, ACK] Seq=1 Ack=2 Win=9 Len=0"
"330","6.486662","192.168.1.6","104.26.10.240","TCP","54","20461  >  443 [ACK] Seq=2 Ack=2 Win=1023 Len=0"
"331","6.487193","142.250.192.4","192.168.1.6","UDP","70","443  >  57976 Len=28"
"332","6.490241","192.168.1.6","142.250.195.170","QUIC","79","Handshake, DCID=f815d463ba19ee7e"
"333","6.490929","192.168.1.6","142.250.192.4","UDP","297","57976  >  443 Len=255"
"334","6.492656","192.168.1.6","142.250.192.4","UDP","691","57976  >  443 Len=649"
"335","6.503651","142.250.195.170","192.168.1.6","QUIC","1292","Handshake, SCID=f815d463ba19ee7e"
"336","6.503651","142.250.195.170","192.168.1.6","QUIC","1292","Handshake, SCID=f815d463ba19ee7e"
"337","6.503977","192.168.1.6","142.250.195.170","QUIC","81","Handshake, DCID=f815d463ba19ee7e"
"338","6.505053","142.250.195.170","192.168.1.6","QUIC","1292","Handshake, SCID=f815d463ba19ee7e"
"339","6.505053","142.250.195.170","192.168.1.6","QUIC","709","Protected Payload (KP0)"
"340","6.505053","142.250.195.170","192.168.1.6","QUIC","85","Handshake, SCID=f815d463ba19ee7e"
"341","6.505053","140.82.112.25","192.168.1.6","TCP","54","443  >  20557 [ACK] Seq=1 Ack=189 Win=76 Len=0"
"342","6.506538","192.168.1.6","142.250.195.170","QUIC","210","Protected Payload (KP0), DCID=f815d463ba19ee7e"
"343","6.507381","192.168.1.6","142.250.195.170","QUIC","1288","Protected Payload (KP0), DCID=f815d463ba19ee7e"
"344","6.507462","192.168.1.6","142.250.195.170","QUIC","1112","Protected Payload (KP0), DCID=f815d463ba19ee7e"
"345","6.507821","140.82.112.25","192.168.1.6","TLSv1.2","127","Application Data"
"346","6.508008","192.168.1.6","140.82.112.25","TCP","54","20557  >  443 [RST, ACK] Seq=220 Ack=74 Win=0 Len=0"
"347","6.513417","142.250.195.170","192.168.1.6","QUIC","1012","Protected Payload (KP0)"
"348","6.513417","142.250.195.170","192.168.1.6","QUIC","163","Protected Payload (KP0)"
"349","6.513495","142.250.192.34","192.168.1.6","QUIC","1004","Protected Payload (KP0)"
"350","6.513719","142.250.195.170","192.168.1.6","QUIC","65","Protected Payload (KP0)"
"351","6.513719","142.250.192.34","192.168.1.6","QUIC","163","Protected Payload (KP0)"
"352","6.513732","192.168.1.6","142.250.195.170","QUIC","76","Protected Payload (KP0), DCID=f815d463ba19ee7e"
"353","6.513847","192.168.1.6","142.250.195.170","QUIC","75","Protected Payload (KP0), DCID=f815d463ba19ee7e"
"354","6.514093","192.168.1.6","142.250.192.34","QUIC","76","Protected Payload (KP0), DCID=ee640d544b265d20"
"355","6.514165","192.168.1.6","142.250.192.34","QUIC","75","Protected Payload (KP0), DCID=ee640d544b265d20"
"356","6.517180","142.250.192.4","192.168.1.6","UDP","70","443  >  57976 Len=28"
"357","6.543824","192.168.1.6","142.250.192.4","UDP","74","57976  >  443 Len=32"
"358","6.551393","192.168.1.6","142.250.195.170","QUIC","1112","Protected Payload (KP0), DCID=f815d463ba19ee7e"
"359","6.551585","142.250.192.34","192.168.1.6","QUIC","70","Protected Payload (KP0)"
"360","6.551585","142.250.195.170","192.168.1.6","QUIC","70","Protected Payload (KP0)"
"361","6.551930","192.168.1.6","142.250.192.34","QUIC","75","Protected Payload (KP0), DCID=ee640d544b265d20"
"362","6.560622","142.250.195.170","192.168.1.6","QUIC","67","Protected Payload (KP0)"
"363","6.560622","142.250.195.170","192.168.1.6","QUIC","875","Protected Payload (KP0)"
"364","6.560824","142.250.192.4","192.168.1.6","UDP","267","443  >  57976 Len=225"
"365","6.560824","142.250.192.4","192.168.1.6","UDP","243","443  >  57976 Len=201"
"366","6.560824","142.250.192.4","192.168.1.6","UDP","63","443  >  57976 Len=21"
